{
  "$schema": "http://json-schema.org/draft-07/schema#",
  "$id": "https://github.com/metyatech/fab-plugin-release-tools/raw/master/FabPluginRelease.schema.json",
  "title": "Fab Plugin Release Configuration",
  "type": "object",
  "additionalProperties": false,
  "required": [
    "schemaVersion",
    "pluginName",
    "descriptorFile",
    "engineVersions",
    "versionTitles",
    "platforms",
    "distributionModules",
    "enabledPluginDependencies",
    "publisher",
    "listingId",
    "documentationUrl",
    "supportUrl",
    "content",
    "includeDirectories",
    "includeFiles",
    "requiredPackageFiles",
    "customDistributionPaths",
    "thirdPartyLicenseSets",
    "forbiddenPackagePatterns",
    "buildLogFailPatterns"
  ],
  "properties": {
    "schemaVersion": { "type": "integer", "enum": [1, 2, 3] },
    "testProject": {
      "type": "object",
      "additionalProperties": false,
      "required": ["repository"],
      "properties": {
        "repository": {
          "type": "string",
          "pattern": "^[A-Za-z0-9](?:[A-Za-z0-9-]{0,38})/[A-Za-z0-9_.-]{1,100}$"
        },
        "distribution": { "enum": ["internal-validation", "fab-additional-file", "external-url"] }
      }
    },
    "pluginName": { "type": "string", "pattern": "^[0-9A-Za-z][0-9A-Za-z_]*$" },
    "descriptorFile": { "$ref": "#/definitions/relativePath" },
    "engineVersions": {
      "type": "array",
      "minItems": 1,
      "uniqueItems": true,
      "items": { "type": "string", "pattern": "^5\\.[0-9]+$" }
    },
    "versionTitles": {
      "type": "object",
      "minProperties": 1,
      "additionalProperties": false,
      "patternProperties": {
        "^5\\.[0-9]+$": { "type": "string", "minLength": 1, "pattern": "\\S" }
      }
    },
    "platforms": {
      "type": "array",
      "minItems": 1,
      "maxItems": 1,
      "items": { "const": "Win64" }
    },
    "distributionModules": { "$ref": "#/definitions/nonEmptyUniqueNames" },
    "enabledPluginDependencies": { "$ref": "#/definitions/uniqueNames" },
    "publisher": {
      "type": "object",
      "additionalProperties": false,
      "required": ["name", "url", "copyrightNotice"],
      "properties": {
        "name": { "type": "string", "minLength": 1 },
        "url": { "$ref": "#/definitions/httpsUrl" },
        "copyrightNotice": { "type": "string", "minLength": 1 }
      }
    },
    "sourceCopyrightOverrides": {
      "type": "array",
      "items": {
        "type": "object",
        "additionalProperties": false,
        "required": ["path", "notices"],
        "properties": {
          "path": { "$ref": "#/definitions/relativePath" },
          "notices": {
            "type": "array",
            "minItems": 2,
            "uniqueItems": true,
            "items": {
              "type": "string",
              "minLength": 1,
              "pattern": "^[^\\r\\n]+$"
            }
          }
        }
      }
    },
    "listingId": {
      "type": ["string", "null"],
      "pattern": "^[0-9a-f]{8}-[0-9a-f]{4}-[0-9a-f]{4}-[0-9a-f]{4}-[0-9a-f]{12}$"
    },
    "documentationUrl": { "$ref": "#/definitions/httpsUrl" },
    "supportUrl": { "$ref": "#/definitions/httpsUrl" },
    "projectFilePublishing": {
      "type": "object",
      "additionalProperties": false,
      "required": ["provider", "cloudflareR2"],
      "properties": {
        "provider": { "const": "CloudflareR2" },
        "cloudflareR2": {
          "type": "object",
          "additionalProperties": false,
          "required": ["bucket", "publicBaseUrl", "objectPrefix"],
          "properties": {
            "bucket": { "type": "string", "minLength": 1, "pattern": "\\S" },
            "publicBaseUrl": { "$ref": "#/definitions/httpsUrl" },
            "objectPrefix": {
              "type": "string",
              "minLength": 1,
              "pattern": "^(?!/)(?!.*(?:^|/)\\.\\.(?:/|$))(?!.*\\\\)(?!.*//$)(?!.*\\/$).+$"
            }
          }
        }
      }
    },
    "content": {
      "oneOf": [
        {
          "type": "object",
          "additionalProperties": false,
          "required": ["mode", "packFolder"],
          "properties": {
            "mode": { "const": "pack" },
            "packFolder": { "type": "string", "pattern": "^[0-9A-Za-z][0-9A-Za-z_]*$" }
          }
        },
        {
          "type": "object",
          "additionalProperties": false,
          "required": ["mode"],
          "properties": { "mode": { "const": "none" } }
        },
        {
          "type": "object",
          "additionalProperties": false,
          "required": ["mode"],
          "properties": {
            "mode": { "const": "plugin" }
          }
        }
      ]
    },
    "includeDirectories": { "$ref": "#/definitions/uniquePaths" },
    "includeFiles": { "$ref": "#/definitions/uniquePaths" },
    "requiredPackageFiles": { "$ref": "#/definitions/uniquePaths" },
    "customDistributionPaths": { "$ref": "#/definitions/uniquePaths" },
    "thirdPartyLicenseSets": {
      "type": "array",
      "items": {
        "type": "object",
        "additionalProperties": false,
        "required": ["root", "files"],
        "properties": {
          "root": { "$ref": "#/definitions/relativePath" },
          "files": { "$ref": "#/definitions/uniquePaths" }
        }
      }
    },
    "forbiddenPackagePatterns": { "$ref": "#/definitions/stringArray" },
    "buildLogFailPatterns": { "$ref": "#/definitions/stringArray" }
  },
  "allOf": [
    {
      "if": { "properties": { "schemaVersion": { "const": 1 } }, "required": ["schemaVersion"] },
      "then": { "not": { "required": ["testProject"] } }
    },
    {
      "if": { "properties": { "schemaVersion": { "const": 2 } }, "required": ["schemaVersion"] },
      "then": { "required": ["testProject"] }
    },
    {
      "if": { "properties": { "schemaVersion": { "const": 3 } }, "required": ["schemaVersion"] },
      "then": {
        "required": ["testProject"],
        "properties": {
          "testProject": { "required": ["repository", "distribution"] }
        }
      }
    }
  ],
  "definitions": {
    "httpsUrl": { "type": "string", "format": "uri", "pattern": "^https://" },
    "relativePath": { "type": "string", "minLength": 1 },
    "uniquePaths": {
      "type": "array",
      "uniqueItems": true,
      "items": { "$ref": "#/definitions/relativePath" }
    },
    "stringArray": {
      "type": "array",
      "items": { "type": "string" }
    },
    "uniqueNames": {
      "type": "array",
      "uniqueItems": true,
      "items": { "type": "string", "minLength": 1 }
    },
    "nonEmptyUniqueNames": {
      "type": "array",
      "minItems": 1,
      "uniqueItems": true,
      "items": { "type": "string", "minLength": 1 }
    }
  }
}
